{
  "$schema": "tfm1-vectors.schema.json",
  "format": 1,
  "hash": "sha256",
  "max_object_size": 67108864,
  "fixture_encoding": "lowercase-hex-lf-v1",
  "golden": [
    {
      "name": "empty-snapshot",
      "fixture": "fixtures/empty-snapshot.hex",
      "snapshot_id": "e67d41aa5666a5bb2d34e8666c51541eadaede2c23570d1580f9ff1b771b3289",
      "description": "no parent and no entries; the smallest canonical manifest"
    },
    {
      "name": "single-blob",
      "fixture": "fixtures/single-blob.hex",
      "snapshot_id": "27a3c27d37afdddf5fc069e904a4bcc491d6c29883bdaf366a143cb13fbc7e6d",
      "description": "one whole-blob regular file: logical size and whole-file digest, no records"
    },
    {
      "name": "large-blob",
      "fixture": "fixtures/large-blob.hex",
      "snapshot_id": "c7f3e50aa2ea8eb543419f9b1770b99e3224ecd045639b3e35f8f84855663c79",
      "description": "a blob declaring 5 GiB + 3 bytes, inexpressible as one record in the retired grammar"
    },
    {
      "name": "empty-blob",
      "fixture": "fixtures/empty-blob.hex",
      "snapshot_id": "c6d502e325c42aa413a466635f96cb03d1c154e290c9c5a380922fcc945a4cf9",
      "description": "a zero-size blob carrying the digest of the empty byte string"
    },
    {
      "name": "tree",
      "fixture": "fixtures/tree.hex",
      "snapshot_id": "0d8e9898c8170405fdb7dad9fde2b390fbf1528d482daa517be121853817aa37",
      "description": "a mixed tree: explicit directories, safetensors records, a config blob, an executable blob"
    },
    {
      "name": "sparse-tensor",
      "fixture": "fixtures/sparse-tensor.hex",
      "snapshot_id": "7e6c88eb031add69abcc952e24b33ad3c831d61c4daeb3ef5a3e60f2cf5a13e8",
      "description": "hole, data, and a beyond-object-size trailing hole in a tensor body"
    },
    {
      "name": "hardlink-group",
      "fixture": "fixtures/hardlink-group.hex",
      "snapshot_id": "0f2aec3c5316027120e7f25a8472d0f7dad77971ceabf5665cade86838e9528b",
      "description": "a three-path link group over a blob, re-rooted onto its first sorted path"
    },
    {
      "name": "symlink",
      "fixture": "fixtures/symlink.hex",
      "snapshot_id": "0077e6803b7837907350fe9b550ea31968d7939146f9a533750aadcdcf27fcf3",
      "description": "a symlink whose target is stored bytes, not a resolved path"
    },
    {
      "name": "empty-directory",
      "fixture": "fixtures/empty-directory.hex",
      "snapshot_id": "501fb3a851bab361eba3d0118586a2105513cf6d8ae13d9aca0558f9b54e7bbe",
      "description": "an explicit directory with no children"
    },
    {
      "name": "boundary-objects",
      "fixture": "fixtures/boundary-objects.hex",
      "snapshot_id": "82dbe014aeea76480e04f8250951342b8d18a58446d4a9f89506c7c3860b8bba",
      "description": "tensor data record lengths 1, 64 MiB minus one, and exactly 64 MiB, plus an empty blob"
    },
    {
      "name": "with-parent",
      "fixture": "fixtures/with-parent.hex",
      "snapshot_id": "c45f7c587a958245a825318a9dbe162d49857ff5ad7b7a9972053e894c974ecd",
      "description": "names the empty snapshot as its explicit parent history"
    },
    {
      "name": "contract-stamped",
      "fixture": "fixtures/contract-stamped.hex",
      "snapshot_id": "63c99e48e27e34342706d3d1266838c8813447a8cbf3e74feffd5e6357ec9ff6",
      "description": "tensor bodies naming the layout contracts that directed their chunking"
    },
    {
      "name": "gguf-provenance",
      "fixture": "fixtures/gguf-provenance.hex",
      "snapshot_id": "cac63d48aa0fd5d8c2c75321fe0e664ed5f2aa8a7c46789631b55d85cf65dbd8",
      "description": "a gguf-v1 planned file pinning the remaining tensor planner tag"
    },
    {
      "name": "contract-digest-stamped",
      "fixture": "fixtures/contract-digest-stamped.hex",
      "snapshot_id": "0ad80825738258437064f4ca691e82a0c10987da64d68f23f95f7d11cde7fe82",
      "description": "a tensor body stamped with a custom contract's canonical digest (0xFF marker + 32 bytes)"
    }
  ],
  "refusals": [
    {
      "name": "bad-magic",
      "fixture": "fixtures/refusal-bad-magic.hex",
      "reason": "bad-magic"
    },
    {
      "name": "truncated",
      "fixture": "fixtures/refusal-truncated.hex",
      "reason": "truncated"
    },
    {
      "name": "trailing-bytes",
      "fixture": "fixtures/refusal-trailing-bytes.hex",
      "reason": "trailing-bytes"
    },
    {
      "name": "parent-flag",
      "fixture": "fixtures/refusal-parent-flag.hex",
      "reason": "parent-flag"
    },
    {
      "name": "entry-order",
      "fixture": "fixtures/refusal-entry-order.hex",
      "reason": "entry-order"
    },
    {
      "name": "duplicate-path",
      "fixture": "fixtures/refusal-duplicate-path.hex",
      "reason": "duplicate-path"
    },
    {
      "name": "case-fold-collision",
      "fixture": "fixtures/refusal-case-fold-collision.hex",
      "reason": "case-fold-collision"
    },
    {
      "name": "missing-parent-directory",
      "fixture": "fixtures/refusal-missing-parent-directory.hex",
      "reason": "missing-parent-directory"
    },
    {
      "name": "path-absolute",
      "fixture": "fixtures/refusal-path-absolute.hex",
      "reason": "path-absolute"
    },
    {
      "name": "path-dot-segment",
      "fixture": "fixtures/refusal-path-dot-segment.hex",
      "reason": "path-dot-segment"
    },
    {
      "name": "path-empty-segment",
      "fixture": "fixtures/refusal-path-empty-segment.hex",
      "reason": "path-empty-segment"
    },
    {
      "name": "path-forbidden-character",
      "fixture": "fixtures/refusal-path-forbidden-character.hex",
      "reason": "path-forbidden-character"
    },
    {
      "name": "path-trailing-dot-space",
      "fixture": "fixtures/refusal-path-trailing-dot-space.hex",
      "reason": "path-trailing-dot-space"
    },
    {
      "name": "path-windows-reserved",
      "fixture": "fixtures/refusal-path-windows-reserved.hex",
      "reason": "path-windows-reserved"
    },
    {
      "name": "path-not-nfc",
      "fixture": "fixtures/refusal-path-not-nfc.hex",
      "reason": "path-not-nfc"
    },
    {
      "name": "path-utf8",
      "fixture": "fixtures/refusal-path-utf8.hex",
      "reason": "path-utf8"
    },
    {
      "name": "path-length",
      "fixture": "fixtures/refusal-path-length.hex",
      "reason": "path-length"
    },
    {
      "name": "unknown-entry-kind",
      "fixture": "fixtures/refusal-unknown-entry-kind.hex",
      "reason": "unknown-entry-kind"
    },
    {
      "name": "executable-flag",
      "fixture": "fixtures/refusal-executable-flag.hex",
      "reason": "executable-flag"
    },
    {
      "name": "unknown-planner",
      "fixture": "fixtures/refusal-unknown-planner.hex",
      "reason": "unknown-planner"
    },
    {
      "name": "contract-version-without-name",
      "fixture": "fixtures/refusal-contract-version-without-name.hex",
      "reason": "contract-version"
    },
    {
      "name": "contract-name-without-version",
      "fixture": "fixtures/refusal-contract-name-without-version.hex",
      "reason": "contract-version"
    },
    {
      "name": "contract-name-uppercase",
      "fixture": "fixtures/refusal-contract-name-uppercase.hex",
      "reason": "contract-name"
    },
    {
      "name": "contract-name-no-producer",
      "fixture": "fixtures/refusal-contract-name-no-producer.hex",
      "reason": "contract-name"
    },
    {
      "name": "contract-name-too-long",
      "fixture": "fixtures/refusal-contract-name-too-long.hex",
      "reason": "contract-name"
    },
    {
      "name": "contract-digest-truncated",
      "fixture": "fixtures/refusal-contract-digest-truncated.hex",
      "reason": "truncated"
    },
    {
      "name": "retired-raw-planner",
      "fixture": "fixtures/refusal-retired-raw-planner.hex",
      "reason": "unknown-planner"
    },
    {
      "name": "unknown-record-tag",
      "fixture": "fixtures/refusal-unknown-record-tag.hex",
      "reason": "unknown-record-tag"
    },
    {
      "name": "zero-length-record",
      "fixture": "fixtures/refusal-zero-length-record.hex",
      "reason": "zero-length-record"
    },
    {
      "name": "adjacent-holes",
      "fixture": "fixtures/refusal-adjacent-holes.hex",
      "reason": "adjacent-holes"
    },
    {
      "name": "data-too-large",
      "fixture": "fixtures/refusal-data-too-large.hex",
      "reason": "data-too-large"
    },
    {
      "name": "length-sum-mismatch",
      "fixture": "fixtures/refusal-length-sum-mismatch.hex",
      "reason": "length-sum-mismatch"
    },
    {
      "name": "length-sum-overflow",
      "fixture": "fixtures/refusal-length-sum-overflow.hex",
      "reason": "length-sum-mismatch"
    },
    {
      "name": "record-limit",
      "fixture": "fixtures/refusal-record-limit.hex",
      "reason": "record-limit"
    },
    {
      "name": "count-exceeds-input",
      "fixture": "fixtures/refusal-count-exceeds-input.hex",
      "reason": "count-exceeds-input"
    },
    {
      "name": "hardlink-ordinal",
      "fixture": "fixtures/refusal-hardlink-ordinal.hex",
      "reason": "hardlink-ordinal"
    },
    {
      "name": "symlink-target",
      "fixture": "fixtures/refusal-symlink-target.hex",
      "reason": "symlink-target"
    },
    {
      "name": "blob-trailing-records",
      "fixture": "fixtures/refusal-blob-trailing-records.hex",
      "reason": "trailing-bytes"
    },
    {
      "name": "blob-truncated-digest",
      "fixture": "fixtures/refusal-blob-truncated-digest.hex",
      "reason": "truncated"
    },
    {
      "name": "empty-blob-digest",
      "fixture": "fixtures/refusal-empty-blob-digest.hex",
      "reason": "empty-blob-digest"
    }
  ]
}
